{
  "project": {
    "working_name": "Aurel",
    "name_status": "chosen",
    "one_liner": "A daily devotional app: one short reading, one reflection prompt and a quiet moment, in under five minutes.",
    "category": "Faith and wellbeing app"
  },
  "stage": "new-brand",
  "objective": "Launch an identity that makes a daily devotional habit feel calm and personal rather than preachy, and stands out from meditation apps.",
  "audiences": [
    {
      "name": "Adults with a faith practice who want a short daily routine",
      "priority": "primary",
      "context": "On their phone, early morning or before sleep, often alone",
      "must_believe": "This will take five minutes and leave me calmer, not lectured."
    },
    {
      "name": "People returning to a practice after a long break",
      "priority": "secondary",
      "context": "Curious but wary of feeling judged",
      "must_believe": "I can start again here without explaining myself."
    }
  ],
  "positioning": {
    "problem": "Devotional content online is either dense and text-heavy or styled like a generic meditation app.",
    "promise": "A quiet five minutes that fits a real morning.",
    "proof": ["One reading and one prompt a day, no feed"],
    "differentiator": null,
    "competitors": ["Large meditation apps", "Daily scripture apps"]
  },
  "persona_test": "Would a tired parent opening this at 6:40 before the kids wake up feel calmer within one screen?",
  "personality": {
    "is": ["calm", "warm", "reverent", "uncluttered"],
    "is_not": ["preachy", "solemn", "trendy wellness", "gamified"]
  },
  "parent_brand": null,
  "surfaces": [
    { "name": "App icon and app store listing", "priority": 1 },
    { "name": "In-app reading screen", "priority": 2 },
    { "name": "Social posts", "priority": 3 }
  ],
  "constraints": {
    "must_include": ["Readable text at default phone sizes"],
    "must_avoid": ["Lotus, sunrise and praying-hands clichés", "Streaks, badges or guilt mechanics"],
    "languages": ["en"],
    "markets": [],
    "accessibility": "WCAG 2.2 AA",
    "fixed": ["Working name Aurel (not yet cleared)"]
  },
  "deliverables": [
    { "item": "Art direction", "format": "art_direction.json", "due": null },
    { "item": "Identity directions", "format": "logo_directions.json", "due": null }
  ],
  "budget": null,
  "assumptions": [
    "Mobile app is the first surface; website and social come later",
    "Content is in English at launch"
  ],
  "open_questions": [
    { "question": "Which launch markets, and is any translation planned for year one?", "owner": "Founder", "blocks": ["brand-naming-rubric"] },
    { "question": "Should the identity signal a specific tradition or stay broadly spiritual?", "owner": "Founder", "blocks": ["logo-identity-directions"] },
    { "question": "What makes this different from scripture apps beyond tone? The differentiator is still blank.", "owner": "Founder and product lead" },
    { "question": "Has 'Aurel' been through a trademark search in the app and software classes?", "owner": "Founder", "blocks": ["logo-identity-directions"] },
    { "question": "What budget is there for launch design and assets?", "owner": "Founder" }
  ],
  "next_skills": [
    { "skill": "art-direction-extractor", "ready": true, "missing": [] },
    { "skill": "logo-identity-directions", "ready": true, "missing": ["Tradition question answered (directions can still start)"] },
    { "skill": "claims-register", "ready": false, "missing": ["List of product features and their release state"] }
  ]
}
